{"type":"baga.publisher-genesis","format":"0.1","display_name":"Example Studio","root_threshold":1,"root_keys":[{"key_id":"ed25519:NHUPmL1Z_PyUbaRaqr6TO-FUpLUJThxKv0KGZQXzyX4","algorithm":"ed25519","public_key":"iojj3XQJ8ZX9UtstPLpdcspnCb8dlBIb83SIAbQPb1w"}],"recovery_threshold":1,"recovery_keys":[{"key_id":"ed25519:ajgD1fBZkCocba-8m6RykhL3yqwIY0zDrnaydSnwOCc","algorithm":"ed25519","public_key":"gTl3Dqh9F19Wo1Rmw0x-zMuNipG07jeiXfYPW4_Js5Q"}],"created_at":"2026-08-22T00:00:00Z"}
